{
  "format": "openbindings.operation-graph@1",
  "kind": "execution",
  "description": "Side-effect-only dead end: process an event and also trigger a notification, but only the process result is operation-graph output. The graph still waits for the dead-end invocation; the pattern is not fire-and-forget.",
  "fixtures": [
    {
      "id": "OG-EX-04",
      "name": "Side-effect-only dead end",
      "section": "Edge definition / Dead ends",
      "description": "in fans out to items.process and notifications.send. Only process has a path to out, so only its result is output. notify is a dead end: it still executes (the runner should observe notifications.send was invoked), but its result is discarded and is not in the expected output.",
      "operations": {
        "items.process": {
          "closesAfter": 1,
          "responses": [
            {
              "emit": [
                {
                  "processed": true
                }
              ]
            }
          ]
        },
        "notifications.send": {
          "closesAfter": 1,
          "responses": [
            {
              "emit": [
                {
                  "sent": true
                }
              ]
            }
          ]
        }
      },
      "graph": {
        "openbindings.operation-graph": "0.2.0",
        "nodes": {
          "in": {
            "type": "input"
          },
          "process": {
            "type": "operation",
            "operation": "items.process"
          },
          "notify": {
            "type": "operation",
            "operation": "notifications.send"
          },
          "out": {
            "type": "output"
          }
        },
        "edges": [
          {
            "from": "in",
            "to": "process"
          },
          {
            "from": "in",
            "to": "notify"
          },
          {
            "from": "process",
            "to": "out"
          }
        ]
      },
      "writes": [
        {
          "id": "x"
        }
      ],
      "expected": {
        "output": [
          {
            "processed": true
          }
        ],
        "ordering": "exact"
      }
    }
  ]
}
